{
  "schema_version": "1",
  "phase": "qa",
  "status": "pass",
  "summary": "All AC-aware QA scenarios passed.",
  "inputs_read": ["context-packet", "implementation-plan", "current-diff", "previous-verdicts"],
  "artifacts_written": ["verdicts/06-qa.json"],
  "evidence": [
    {
      "type": "qa-scenario",
      "description": "AC-1 happy path passed locally.",
      "path": "phases/06-qa/notes.md",
      "url": null,
      "acceptance_criteria": ["AC-1"]
    }
  ],
  "fix_requests": [],
  "blockers": [],
  "stale_artifacts": [],
  "next_recommendation": "continue"
}
